### ISSUE TITLE
[BUG] Keep receive TCP RST from agent

### ISSUE THREAD

**Issue by jiekun** [deepflowio/deepflow#4575]
### Search before asking

- [X] I had searched in the [issues](https://github.com/deepflowio/deepflow/issues?q=is%3Aissue) and found no similar feature requirement.

### DeepFlow Component

Agent

### What you expected to happen

在服务端不断观察到如下报错日志：
```
[33m2023-10-25 19:03:48.745 [WARN][0m [receiver] receiver.go:828 TCP client(10.211.3.5:32576) connection read error.read tcp 10.211.0.124:20033->10.211.3.5:32576: read: connection reset by peer
2023-10-25 19:03:48.795 [INFO][0m [receiver] receiver.go:756 TCP client(10.211.4.44:32033) connect success, set read buffer 4194304.
[33m2023-10-25 19:03:48.795 [WARN][0m [receiver] receiver.go:828 TCP client(10.211.4.44:32033) connection read error.read tcp 10.211.0.124:20033->10.211.4.44:32033: read: connection reset by peer
2023-10-25 19:03:49.052 [INFO][0m [receiver] receiver.go:756 TCP client(10.211.6.150:54611) connect success, set read buffer 4194304.
[33m2023-10-25 19:03:49.052 [WARN][0m [receiver] receiver.go:828 TCP client(10.211.6.150:54611) connection read error.read tcp 10.211.0.124:20033->10.211.6.150:54611: read: connection reset by peer
2023-10-25 19:03:49.120 [INFO][0m [genesis] grpc_server.go:174 genesis sync received version 1698203686 -> 1698203687 from ip 10.212.251.118 vtap_id 26
2023-10-25 19:03:49.151 [INFO][0m [genesis] grpc_server.go:174 genesis sync received version 1698203687 -> 1698203688 from ip 10.212.251.208 vtap_id 190
2023-10-25 19:03:49.417 [INFO][0m [receiver] receiver.go:756 TCP client(10.211.5.40:37307) connect success, set read buffer 4194304.
[33m2023-10-25 19:03:49.417 [WARN][0m [receiver] receiver.go:828 TCP client(10.211.5.40:37307) connection read error.read tcp 10.211.0.124:20033->10.211.5.40:37307: read: connection reset by peer
2023-10-25 19:03:49.520 [INFO][0m [receiver] receiver.go:756 TCP client(10.211.6.107:40403) connect success, set read buffer 4194304.
[33m2023-10-25 19:03:49.520 [WARN][0m [receiver] receiver.go:828 TCP client(10.211.6.107:40403) connection read error.read tcp 10.211.0.124:20033->10.211.6.107:40403: read: connection reset by peer
2023-10-25 19:03:49.766 [INFO][0m [receiver] receiver.go:756 TCP client(10.211.0.208:60895) connect success, set read buffer 4194304.
[33m2023-10-25 19:03:49.766 [WARN][0m [receiver] receiver.go:828 TCP client(10.211.0.208:60895) connection read error.read tcp 10.211.0.124:20033->10.211.0.208:60895: read: connection reset by peer
2023-10-25 19:03:49.788 [INFO][0m [receiver] receiver.go:756 TCP client(10.211.0.208:57901) connect success, set read buffer 4194304.
[33m2023-10-25 19:03:49.788 [WARN][0m [receiver] receiver.go:828 TCP client(10.211.0.208:57901) connection read error.read tcp 10.211.0.124:20033->10.211.0.208:57901: read: connection reset by peer
2023-10-25 19:03:49.966 [INFO][0m [receiver] receiver.go:756 TCP client(10.211.6.107:41668) connect success, set read buffer 4194304.
[33m2023-10-25 19:03:49.966 [WARN][0m [receiver] receiver.go:828 TCP client(10.211.6.107:41668) connection read error.read tcp 10.211.0.124:20033->10.211.6.107:41668: read: connection reset by peer
2023-10-25 19:03:50.050 [INFO][0m [receiver] receiver.go:756 TCP client(10.211.1.56:15713) connect success, set read buffer 4194304.
[33m2023-10-25 19:03:50.050 [WARN][0m [receiver] receiver.go:828 TCP client(10.211.1.56:15713) connection read error.read tcp 10.211.0.124:20033->10.211.1.56:15713: read: connection reset by peer
2023-10-25 19:03:50.142 [INFO][0m [receiver] receiver.go:756 TCP client(10.211.3.5:33565) connect success, set read buffer 4194304.
[33m2023-10-25 19:03:50.143 [WARN][0m [receiver] receiver.go:828 TCP client(10.211.3.5:33565) connection read error.read tcp 10.211.0.124:20033->10.211.3.5:33565: read: connection reset by peer
2023-10-25 19:03:50.432 [INFO][0m [receiver] receiver.go:756 TCP client(10.211.6.150:20439) connect success, set read buffer 4194304.
[33m2023-10-25 19:03:50.433 [WARN][0m [receiver] receiver.go:828 TCP client(10.211.6.150:20439) connection read error.read tcp 10.211.0.124:20033->10.211.6.150:20439: read: connection reset by peer
2023-10-25 19:03:50.651 [INFO][0m [receiver] receiver.go:756 TCP client(10.211.4.44:21121) connect success, set read buffer 4194304.
[33m2023-10-25 19:03:50.651 [WARN][0m [receiver] receiver.go:828 TCP client(10.211.4.44:21121) connection read error.read tcp 10.211.0.124:20033->10.211.4.44:21121: read: connection reset by peer
2023-10-25 19:03:50.660 [INFO][0m [receiver] receiver.go:756 TCP client(10.211.4.44:42622) connect success, set read buffer 4194304.
[33m2023-10-25 19:03:50.661 [WARN][0m [receiver] receiver.go:828 TCP client(10.211.4.44:42622) connection read error.read tcp 10.211.0.124:20033->10.211.4.44:42622: read: connection reset by peer
2023-10-25 19:03:50.758 [INFO][0m [receiver] receiver.go:756 TCP client(10.211.1.56:1029) connect success, set read buffer 4194304.
[33m2023-10-25 19:03:50.758 [WARN][0m [receiver] receiver.go:828 TCP client(10.211.1.56:1029) connection read error.read tcp 10.211.0.124:20033->10.211.1.56:1029: read: connection reset by peer
2023-10-25 19:03:51.013 [INFO][0m [receiver] receiver.go:756 TCP client(10.211.3.5:18484) connect success, set read buffer 4194304.
[33m2023-10-25 19:03:51.013 [WARN][0m [receiver] receiver.go:828 TCP client(10.211.3.5:18484) connection read error.read tcp 10.211.0.124:20033->10.211.3.5:18484: read: connection reset by peer
2023-10-25 19:03:51.017 [INFO][0m [receiver] receiver.go:756 TCP client(10.211.5.40:3231) connect success, set read buffer 4194304.
[33m2023-10-25 19:03:51.017 [WARN][0m [receiver] receiver.go:828 TCP client(10.211.5.40:3231) connection read error.read tcp 10.211.0.124:20033->10.211.5.40:3231: read: connection reset by peer
2023-10-25 19:03:51.091 [GIN] 169.254.1.1 GET /v1/health/ 200 70.119µs
2023-10-25 19:03:51.091 [GIN] 169.254.1.1 GET /v1/health/ 200 70.973µs
2023-10-25 19:03:51.128 [INFO][0m [receiver] receiver.go:756 TCP client(10.211.3.5:31741) connect success, set read buffer 4194304.
[33m2023-10-25 19:03:51.129 [WARN][0m [receiver] receiver.go:828 TCP client(10.211.3.5:31741) connection read error.read tcp 10.211.0.124:20033->10.211.3.5:31741: read: connection reset by peer
2023-10-25 19:03:51.133 [INFO][0m [receiver] receiver.go:756 TCP client(10.211.6.150:32636) connect success, set read buffer 4194304.
[33m2023-10-25 19:03:51.133 [WARN][0m [receiver] receiver.go:828 TCP client(10.211.6.150:32636) connection read error.read tcp 10.211.0.124:20033->10.211.6.150:32636: read: connection reset by peer
2023-10-25 19:03:51.175 [INFO][0m [receiver] receiver.go:756 TCP client(10.211.5.40:25196) connect success, set read buffer 4194304.
[33m2023-10-25 19:03:51.175 [WARN][0m [receiver] receiver.go:828 TCP client(10.211.5.40:25196) connection read error.read tcp 10.211.0.124:20033->10.211.5.40:25196: read: connection reset by peer
2023-10-25 19:03:51.186 [INFO][0m [receiver] receiver.go:756 TCP client(10.211.6.107:1813) connect success, set read buffer 4194304.
[33m2023-10-25 19:03:51.187 [WARN][0m [receiver] receiver.go:828 TCP client(10.211.6.107:1813) connection read error.read tcp 10.211.0.124:20033->10.211.6.107:1813: read: connection reset by peer
2023-10-25 19:03:51.240 [INFO][0m [receiver] receiver.go:756 TCP client(10.211.0.208:38617) connect success, set read buffer 4194304.
[33m2023-10-25 19:03:51.241 [WARN][0m [receiver] receiver.go:828 TCP client(10.211.0.208:38617) connection read error.read tcp 10.211.0.124:20033->10.211.0.208:38617: read: connection reset by peer
2023-10-25 19:03:51.277 [INFO][0m [receiver] receiver.go:756 TCP client(10.211.1.56:59538) connect success, set read buffer 4194304.
[33m2023-10-25 19:03:51.277 [WARN][0m [receiver] receiver.go:828 TCP client(10.211.1.56:59538) connection read error.read tcp 10.211.0.124:20033->10.211.1.56:59538: read: connection reset by peer
2023-10-25 19:03:51.355 [INFO][0m [receiver] receiver.go:756 TCP client(10.211.0.208:16306) connect success, set read buffer 4194304.
[33m2023-10-25 19:03:51.356 [WARN][0m [receiver] receiver.go:828 TCP client(10.211.0.208:16306) connection read error.read tcp 10.211.0.124:20033->10.211.0.208:16306: read: connection reset by peer
2023-10-25 19:03:51.391 [INFO][0m [receiver] receiver.go:756 TCP client(10.211.6.107:1975) connect success, set read buffer 4194304.
[33m2023-10-25 19:03:51.392 [WARN][0m [receiver] receiver.go:828 TCP client(10.211.6.107:1975) connection read error.read tcp 10.211.0.124:20033->10.211.6.107:1975: read: connection reset by peer
2023-10-25 19:03:51.402 [INFO][0m [receiver] receiver.go:756 TCP client(10.211.6.150:17984) connect success, set read buffer 4194304.
[33m2023-10-25 19:03:51.402 [WARN][0m [receiver] receiver.go:828 TCP client(10.211.6.150:17984) connection read error.read tcp 10.211.0.124:20033->10.211.6.150:17984: read: connection reset by peer
```

通过抓包发现存在 Agent 端发起的 TCP 握手，但是握手结束后发送了 RST 包：
```
 6098   0.226783 10.211.2.236 → 10.211.1.56  TCP 56 20033 → 46718 [ACK] Seq=1 Ack=1633085 Win=358 Len=0
 6099   0.226802  10.211.1.56 → 10.211.2.236 TCP 5872 46718 → 20033 [ACK] Seq=1633085 Ack=1 Win=58 Len=5808
 6100   0.226809 10.211.2.236 → 10.211.1.56  TCP 56 20033 → 46718 [ACK] Seq=1 Ack=1638893 Win=358 Len=0
 6108   0.226917  10.211.1.56 → 10.211.2.236 TCP 7324 46718 → 20033 [ACK] Seq=1638893 Ack=1 Win=58 Len=7260
 6109   0.226924 10.211.2.236 → 10.211.1.56  TCP 56 20033 → 46718 [ACK] Seq=1 Ack=1646153 Win=358 Len=0
 6110   0.226924  10.211.1.56 → 10.211.2.236 TCP 1516 46718 → 20033 [ACK] Seq=1646153 Ack=1 Win=58 Len=1452
 6117   0.226974  10.211.1.56 → 10.211.2.236 TCP 308 46718 → 20033 [PSH, ACK] Seq=1647605 Ack=1 Win=58 Len=244
 6118   0.226983 10.211.2.236 → 10.211.1.56  TCP 56 20033 → 46718 [ACK] Seq=1 Ack=1647849 Win=358 Len=0

 6152   0.227654  10.211.1.56 → 10.211.2.236 TCP 68 45536 → 20033 [SYN] Seq=0 Win=26880 Len=0 MSS=8960 SACK_PERM=1 WS=128
 6154   0.227678 10.211.2.236 → 10.211.1.56  TCP 68 20033 → 45536 [SYN, ACK] Seq=0 Ack=1 Win=29200 Len=0 MSS=1460 SACK_PERM=1 WS=512
 6201   0.229087  10.211.1.56 → 10.211.2.236 TCP 56 45536 → 20033 [ACK] Seq=1 Ack=1 Win=26880 Len=0
 6202   0.229118  10.211.1.56 → 10.211.2.236 TCP 56 45536 → 20033 [RST, ACK] Seq=1 Ack=1 Win=26880 Len=0

 6613   0.250314  10.211.1.56 → 10.211.2.236 TCP 8386 46718 → 20033 [PSH, ACK] Seq=1647849 Ack=1 Win=58 Len=8322
 6614   0.250335 10.211.2.236 → 10.211.1.56  TCP 56 20033 → 46718 [ACK] Seq=1 Ack=1656171 Win=358 Len=0
 6616   0.250339  10.211.1.56 → 10.211.2.236 TCP 4420 46718 → 20033 [ACK] Seq=1656171 Ack=1 Win=58 Len=4356
 6617   0.250346 10.211.2.236 → 10.211.1.56  TCP 56 20033 → 46718 [ACK] Seq=1 Ack=1660527 Win=358 Len=0
 6620   0.250358  10.211.1.56 → 10.211.2.236 TCP 2968 46718 → 20033 [ACK] Seq=1660527 Ack=1 Win=58 Len=2904
 6621   0.250364 10.211.2.236 → 10.211.1.56  TCP 56 20033 → 46718 [ACK] Seq=1 Ack=1663431 Win=358 Len=0
 6622   0.250414  10.211.1.56 → 10.211.2.236 TCP 2968 46718 → 20033 [ACK] Seq=1663431 Ack=1 Win=58 Len=2904
```

### How to reproduce

N/A

### DeepFlow version

v6.40.0

### Kubernetes CNI

N/A

### Operation-System/Kernel version

N/A

### Are you willing to submit a PR?

- [ ] Yes I am willing to submit a PR!

### Code of Conduct

- [X] I agree to follow this project's [Code of Conduct](https://github.com/deepflowio/deepflow/blob/main/CODE_OF_CONDUCT.md)

**Comment by jiekun** [comment]
一些奇怪的排查记录：
1. Agent 所处节点的 TCP 连接数非常低；
2. Agent 在集群内访问和绕道 LB 都没有解决问题；
3. Server 基础镜像使用 Ubuntu 和 aphine 都有相同问题；

提 issue 想确认 Agent 内是否有自己的 TCP 连接管理，什么情况下会发起 SYN

**Comment by jiekun** [comment]
ping @yuanchaoa @rvql for help. Could provide more infomation if necessary.

**Comment by jiekun** [comment]
![w48IKLC7jr](https://github.com/deepflowio/deepflow/assets/30280396/6ca20244-6855-4ae0-af40-806f4672190c)

**Comment by sharang** [comment]
> 一些奇怪的排查记录：
> 
> 1. Agent 所处节点的 TCP 连接数非常低；
> 2. Agent 在集群内访问和绕道 LB 都没有解决问题；
> 3. Server 基础镜像使用 Ubuntu 和 aphine 都有相同问题；
> 
> 提 issue 想确认 Agent 内是否有自己的 TCP 连接管理，什么情况下会发起 SYN

@jiekun 以往此类问题一般是由于网络中存在 TCP 端口扫描导致。
Agent 自身没有额外的 TCP 连接管理机制。

@lzf575 @rvql 看看这个问题的原因。
